{
  "schema_version": 1,
  "package": "credit_default",
  "version": "1.0",
  "configuration": "rules_only",
  "run_id": "credit_default-rules_only-20260918T065334Z-bd5861e9",
  "illustrative": false,
  "findings": [
    {
      "id": "F-001",
      "defect_class": "T1",
      "severity": "high",
      "suggested_severity": "high",
      "severity_reason": null,
      "tool": "compute_metrics",
      "title": "A `T1` finding, raised by `compute_metrics` at severity `high`.",
      "narrative": "Its evidence is the artifacts cited in this section; the check's own account of it is recorded in `findings.json`.",
      "evidence": [
        "5487ddda",
        "5c6c2bfc"
      ],
      "section": "outcomes",
      "candidates_merged": 1
    },
    {
      "id": "F-002",
      "defect_class": "E1",
      "severity": "low",
      "suggested_severity": "low",
      "severity_reason": null,
      "tool": "challenger_compare",
      "title": "A `E1` finding, raised by `challenger_compare` at severity `low`.",
      "narrative": "Its evidence is the artifacts cited in this section; the check's own account of it is recorded in `findings.json`.\nThe value of `challenger.auc` is 0.824 [[art:bf5be719:challenger.auc]].\nThe value of `challenger.delta_auc` is 0.07598 [[art:c9e502ae:challenger.delta_auc]].\nThe value of `metrics.test.auc` is 0.748 [[art:5c6c2bfc:metrics.test.auc]].\nThe value of `sign_check.delinq_max_6m.agrees` is 0 [[art:c946359c:sign_check.delinq_max_6m.agrees]].\nThe value of `sign_check.delinq_max_6m.coef_sign` is -1 [[art:a07d68ab:sign_check.delinq_max_6m.coef_sign]].\nThe value of `sign_check.delinq_max_6m.univariate_direction` is 1 [[art:b9088f4a:sign_check.delinq_max_6m.univariate_direction]].\nThe value of `sign_check.limit_bal.agrees` is 0 [[art:0278aad1:sign_check.limit_bal.agrees]].\nThe value of `sign_check.limit_bal.coef_sign` is 1 [[art:6af6aef2:sign_check.limit_bal.coef_sign]].\nThe value of `sign_check.limit_bal.univariate_direction` is -1 [[art:56d284d6:sign_check.limit_bal.univariate_direction]].\nThe value of `sign_check.pay_ratio_last.agrees` is 0 [[art:79abee77:sign_check.pay_ratio_last.agrees]].\nThe value of `sign_check.pay_ratio_last.coef_sign` is 1 [[art:f018263e:sign_check.pay_ratio_last.coef_sign]].\nThe value of `sign_check.pay_ratio_last.univariate_direction` is -1 [[art:f8e46d75:sign_check.pay_ratio_last.univariate_direction]].\nThe value of `threshold.E1.delta_auc` is 0.03 [[art:e042774c:threshold.E1.delta_auc]].\nThe value of `threshold.package.auc.test.min` is 0.78 [[art:5487ddda:threshold.package.auc.test.min]].",
      "evidence": [
        "5c6c2bfc",
        "bf5be719",
        "c9e502ae",
        "e042774c"
      ],
      "section": "conceptual_soundness",
      "candidates_merged": 1
    }
  ],
  "candidates_not_promoted": [],
  "checks_without_candidates": {
    "profile_data": [
      "D1",
      "S1"
    ],
    "compute_metrics": [
      "C1",
      "O1"
    ],
    "check_leakage": [
      "L1",
      "L2"
    ],
    "check_collinearity": [
      "M1"
    ]
  }
}
