{
  "schema_version": 1,
  "package": "msr_prepayment",
  "version": "1.0",
  "configuration": "full_agent",
  "run_id": "msr_prepayment-full_agent-20260920T005827Z-e61d346a",
  "illustrative": false,
  "findings": [],
  "candidates_not_promoted": [],
  "checks_without_candidates": {
    "profile_data": [
      "D1",
      "S1"
    ],
    "compute_metrics": [
      "T1",
      "C1",
      "O1"
    ],
    "check_leakage": [
      "L1",
      "L2"
    ],
    "check_stability": [
      "R1"
    ],
    "check_collinearity": [
      "M1"
    ],
    "challenger_compare": [
      "E1"
    ],
    "run_scenarios": [
      "X1"
    ]
  }
}
